[
  {
    "candidate_id": "cand_51f52eb9fdbe",
    "full_name": "Jane Doe",
    "emails": [
      "jane.doe@example.com",
      "jdoe@personal.example"
    ],
    "phones": [
      "+14155550132"
    ],
    "location": {
      "city": "San Francisco",
      "region": "CA",
      "country": "US"
    },
    "links": {
      "linkedin": "https://linkedin.com/in/janedoe",
      "github": "https://github.com/janedoe",
      "portfolio": null,
      "other": []
    },
    "headline": "Staff Software Engineer",
    "years_experience": 8.0,
    "skills": [
      {
        "name": "React",
        "confidence": 0.99,
        "sources": [
          "ats_json",
          "recruiter_csv",
          "resume"
        ]
      },
      {
        "name": "AWS",
        "confidence": 0.98,
        "sources": [
          "recruiter_csv",
          "resume"
        ]
      },
      {
        "name": "JavaScript",
        "confidence": 0.98,
        "sources": [
          "ats_json",
          "recruiter_csv"
        ]
      },
      {
        "name": "Python",
        "confidence": 0.98,
        "sources": [
          "recruiter_csv",
          "resume"
        ]
      },
      {
        "name": "Kubernetes",
        "confidence": 0.9,
        "sources": [
          "recruiter_csv"
        ]
      },
      {
        "name": "Docker",
        "confidence": 0.59,
        "sources": [
          "ats_json",
          "resume"
        ]
      },
      {
        "name": "Node.js",
        "confidence": 0.59,
        "sources": [
          "ats_json",
          "resume"
        ]
      },
      {
        "name": "PostgreSQL",
        "confidence": 0.59,
        "sources": [
          "ats_json",
          "resume"
        ]
      },
      {
        "name": "TypeScript",
        "confidence": 0.42,
        "sources": [
          "resume"
        ]
      }
    ],
    "experience": [
      {
        "company": "Acme Corp",
        "title": "Senior Software Engineer",
        "start": "2021-03",
        "end": "present",
        "summary": null
      },
      {
        "company": "Acme Corporation",
        "title": "Staff Software Engineer",
        "start": null,
        "end": null,
        "summary": null
      },
      {
        "company": "Initech",
        "title": "Software Engineer",
        "start": "2018",
        "end": "2021",
        "summary": null
      }
    ],
    "education": [
      {
        "institution": "UC Berkeley",
        "degree": "B.S.",
        "field": "Computer Science",
        "end_year": 2016
      }
    ],
    "provenance": [
      {
        "field": "full_name",
        "source": "recruiter_csv",
        "method": "recruiter_csv:column:name"
      },
      {
        "field": "full_name",
        "source": "ats_json",
        "method": "ats_json:applicant.fullName"
      },
      {
        "field": "full_name",
        "source": "resume",
        "method": "resume:heuristic:first-line"
      },
      {
        "field": "emails",
        "source": "recruiter_csv",
        "method": "recruiter_csv:column:email"
      },
      {
        "field": "emails",
        "source": "ats_json",
        "method": "ats_json:applicant.email"
      },
      {
        "field": "emails",
        "source": "resume",
        "method": "resume:regex:email"
      },
      {
        "field": "phones",
        "source": "recruiter_csv",
        "method": "recruiter_csv:column:phone"
      },
      {
        "field": "phones",
        "source": "ats_json",
        "method": "ats_json:applicant.mobileNumber"
      },
      {
        "field": "phones",
        "source": "resume",
        "method": "resume:regex:phone"
      },
      {
        "field": "location",
        "source": "recruiter_csv",
        "method": "recruiter_csv:column:location"
      },
      {
        "field": "location",
        "source": "ats_json",
        "method": "ats_json:applicant.location"
      },
      {
        "field": "links.linkedin",
        "source": "recruiter_csv",
        "method": "recruiter_csv:column:linkedin"
      },
      {
        "field": "links.linkedin",
        "source": "ats_json",
        "method": "ats_json:social.linkedinUrl"
      },
      {
        "field": "links.linkedin",
        "source": "resume",
        "method": "resume:regex:url"
      },
      {
        "field": "links.github",
        "source": "recruiter_csv",
        "method": "recruiter_csv:column:github"
      },
      {
        "field": "links.github",
        "source": "ats_json",
        "method": "ats_json:social.githubUrl"
      },
      {
        "field": "links.github",
        "source": "resume",
        "method": "resume:regex:url"
      },
      {
        "field": "headline",
        "source": "recruiter_csv",
        "method": "recruiter_csv:column:title"
      },
      {
        "field": "headline",
        "source": "ats_json",
        "method": "ats_json:applicant.headline"
      },
      {
        "field": "years_experience",
        "source": "ats_json",
        "method": "ats_json:applicant.yearsOfExperience"
      },
      {
        "field": "skills",
        "source": "recruiter_csv",
        "method": "recruiter_csv:column:skills"
      },
      {
        "field": "skills",
        "source": "ats_json",
        "method": "ats_json:competencies"
      },
      {
        "field": "skills",
        "source": "resume",
        "method": "resume:section:skills"
      },
      {
        "field": "experience",
        "source": "recruiter_csv",
        "method": "recruiter_csv:columns:company+title"
      },
      {
        "field": "experience",
        "source": "ats_json",
        "method": "ats_json:employment"
      },
      {
        "field": "education",
        "source": "ats_json",
        "method": "ats_json:schools"
      },
      {
        "field": "education",
        "source": "resume",
        "method": "resume:section:education"
      }
    ],
    "overall_confidence": 0.8197
  },
  {
    "candidate_id": "cand_c67b97317f4a",
    "full_name": "Priya Sharma",
    "emails": [
      "priya.sharma@example.in"
    ],
    "phones": [
      "+919876543210"
    ],
    "location": {
      "city": "Bengaluru",
      "region": null,
      "country": "IN"
    },
    "links": {
      "linkedin": "https://linkedin.com/in/priyasharma",
      "github": null,
      "portfolio": null,
      "other": []
    },
    "headline": "ML Engineer",
    "years_experience": 5.0,
    "skills": [
      {
        "name": "Deep Learning",
        "confidence": 0.51,
        "sources": [
          "ats_json"
        ]
      },
      {
        "name": "PyTorch",
        "confidence": 0.51,
        "sources": [
          "ats_json"
        ]
      },
      {
        "name": "Python",
        "confidence": 0.51,
        "sources": [
          "ats_json"
        ]
      },
      {
        "name": "TensorFlow",
        "confidence": 0.51,
        "sources": [
          "ats_json"
        ]
      }
    ],
    "experience": [
      {
        "company": "Flipkart",
        "title": "Machine Learning Engineer",
        "start": "2020-07",
        "end": "present",
        "summary": null
      }
    ],
    "education": [
      {
        "institution": "IIT Bombay",
        "degree": "M.Tech",
        "field": "Data Science",
        "end_year": 2019
      }
    ],
    "provenance": [
      {
        "field": "full_name",
        "source": "ats_json",
        "method": "ats_json:applicant.fullName"
      },
      {
        "field": "emails",
        "source": "ats_json",
        "method": "ats_json:applicant.email"
      },
      {
        "field": "phones",
        "source": "ats_json",
        "method": "ats_json:applicant.mobileNumber"
      },
      {
        "field": "location",
        "source": "ats_json",
        "method": "ats_json:applicant.location"
      },
      {
        "field": "links.linkedin",
        "source": "ats_json",
        "method": "ats_json:social.linkedinUrl"
      },
      {
        "field": "headline",
        "source": "ats_json",
        "method": "ats_json:applicant.headline"
      },
      {
        "field": "years_experience",
        "source": "ats_json",
        "method": "ats_json:applicant.yearsOfExperience"
      },
      {
        "field": "skills",
        "source": "ats_json",
        "method": "ats_json:competencies"
      },
      {
        "field": "experience",
        "source": "ats_json",
        "method": "ats_json:employment"
      },
      {
        "field": "education",
        "source": "ats_json",
        "method": "ats_json:schools"
      }
    ],
    "overall_confidence": 0.51
  },
  {
    "candidate_id": "cand_cd3dcb374e9d",
    "full_name": "John Smith",
    "emails": [
      "john.smith@example.com"
    ],
    "phones": [
      "+442079460958"
    ],
    "location": {
      "city": "London",
      "region": null,
      "country": "GB"
    },
    "links": {
      "linkedin": "https://linkedin.com/in/johnsmith",
      "github": null,
      "portfolio": null,
      "other": []
    },
    "headline": "Data Scientist",
    "years_experience": null,
    "skills": [
      {
        "name": "Machine Learning",
        "confidence": 0.9,
        "sources": [
          "recruiter_csv"
        ]
      },
      {
        "name": "Python",
        "confidence": 0.9,
        "sources": [
          "recruiter_csv"
        ]
      },
      {
        "name": "SQL",
        "confidence": 0.9,
        "sources": [
          "recruiter_csv"
        ]
      }
    ],
    "experience": [
      {
        "company": "Globex",
        "title": "Data Scientist",
        "start": null,
        "end": null,
        "summary": null
      }
    ],
    "education": [],
    "provenance": [
      {
        "field": "full_name",
        "source": "recruiter_csv",
        "method": "recruiter_csv:column:name"
      },
      {
        "field": "emails",
        "source": "recruiter_csv",
        "method": "recruiter_csv:column:email"
      },
      {